voie;name;name_norm;last_word_norm;ways
;Ancienne Voie de Chemin de Fer de Bertholène à Espalion;ANCIENNE VOIE DE CHEMIN DE FER DE BERTHOLENE A ESPALION;ESPALION;284797523
CHEMIN;Chemin du Calvaire;DU CALVAIRE;CALVAIRE;140903811,217356727,241638268
ROUTE;Route d'Espalion à Millau;D ESPALION A MILLAU;MILLAU;36927183,217952405,217952411,317794975,317794976,317794977,317794978,317794979
ROUTE;Route de Gabriac à Montrozier;DE GABRIAC A MONTROZIER;MONTROZIER;124388718,234406566
ROUTE;Route de la Lozère à Rodez;DE LA LOZERE A RODEZ;RODEZ;217952406,217952409,234405460
VOIE;Voie Verte de Bertholène à Espalion;VERTE DE BERTHOLENE A ESPALION;ESPALION;284797524
