voie;name;name_norm;last_word_norm;ways
;Acces à la Falaise;ACCES A LA FALAISE;FALAISE;515891283
;Acces à la Falaise du Bry;ACCES A LA FALAISE DU BRY;BRY;634124692
ANCIEN CHEMIN;Ancien Chemin de Bellevaux à Seytroux;DE BELLEVAUX A SEYTROUX;SEYTROUX;338843395,338843399,338843404,338843892
ANCIEN CHEMIN;Ancien Chemin de La Clusaz à Vallon;DE LA CLUSAZ A VALLON;VALLON;339892546
ANCIEN CHEMIN;Ancien Chemin de Lullin à Chez le Rey;DE LULLIN A CHEZ LE REY;REY;345949940,345954752
ANCIEN CHEMIN;Ancien Chemin des Fayaux à Bellevaux;DES FAYAUX A BELLEVAUX;BELLEVAUX;338537587
ANCIEN CHEMIN;Ancien Chemin du Frêne à Vallon;DU FRENE A VALLON;VALLON;338968279
;Au Parchy;AU PARCHY;PARCHY;340153737
CHEMIN;Chemin Nant-Blanc;NANT BLANC;BLANC;177013853
CHEMIN;Chemin Sous les Lanches;SOUS LES LANCHES;LANCHES;266719457,266719458
CHEMIN;Chemin d'Exploitation Forestière;D EXPLOITATION FORESTIERE;FORESTIERE;421694556
CHEMIN;Chemin de Bellevaux à Gembaz;DE BELLEVAUX A GEMBAZ;GEMBAZ;340252356
CHEMIN;Chemin de Bellevaux à Nifflon;DE BELLEVAUX A NIFFLON;NIFFLON;338788571
CHEMIN;Chemin de Chez Chaudron;DE CHEZ CHAUDRON;CHAUDRON;331496787
CHEMIN;Chemin de Gembaz;DE GEMBAZ;GEMBAZ;340252166
CHEMIN;Chemin de Recard;DE RECARD;RECARD;340251858
CHEMIN;Chemin de Sorvais;DE SORVAIS;SORVAIS;198651888,338988537,338988538
CHEMIN;Chemin de Vallon;DE VALLON;VALLON;339921259,339921428
CHEMIN;Chemin de l'Adret;DE L ADRET;ADRET;344726708,344726714
CHEMIN;Chemin de l'Ermont aux Bossons;DE L ERMONT AUX BOSSONS;BOSSONS;338674259
CHEMIN;Chemin de l'Église;DE L EGLISE;EGLISE;30700461,198651889
CHEMIN;Chemin de la Chèvrerie au Finge;DE LA CHEVRERIE AU FINGE;FINGE;339792669
CHEMIN;Chemin de la Chèvrerie à Foron;DE LA CHEVRERIE A FORON;FORON;330954583,386909525,527379018
CHEMIN;Chemin de la Chèvrerie à Pététoz;DE LA CHEVRERIE A PETETOZ;PETETOZ;177014187
CHEMIN;Chemin de la Cuvette;DE LA CUVETTE;CUVETTE;188121993
CHEMIN;Chemin de la Côte;DE LA COTE;COTE;339977392,339977395
CHEMIN;Chemin de la Planche;DE LA PLANCHE;PLANCHE;331403998
CHEMIN;Chemin de la Ravière;DE LA RAVIERE;RAVIERE;266414752
CHEMIN;Chemin de la Sciaux;DE LA SCIAUX;SCIAUX;340251819,340251820
CHEMIN;Chemin de la Scierie;DE LA SCIERIE;SCIERIE;177011505,331512830
CHEMIN;Chemin de la Taillaz Rossaz;DE LA TAILLAZ ROSSAZ;ROSSAZ;338500916
CHEMIN;Chemin de la Tire des Frênes;DE LA TIRE DES FRENES;FRENES;344726710,345949234,345949235
CHEMIN;Chemin des Châlets d'Hirmentaz;DES CHALETS D HIRMENTAZ;HIRMENTAZ;266388961
CHEMIN;Chemin des Mouilles;DES MOUILLES;MOUILLES;266711486,266711488,266711489,266717488,458315171
CHEMIN;Chemin des Mouilles Corbet;DES MOUILLES CORBET;CORBET;225902304
CHEMIN;Chemin des Mouilles à La Côte;DES MOUILLES A LA COTE;COTE;339977393
CHEMIN;Chemin des Nants à l'Indivis de Vallon;DES NANTS A L INDIVIS DE VALLON;VALLON;235985711
CHEMIN;Chemin du Chable;DU CHABLE;CHABLE;340149764
CHEMIN;Chemin du Chef-Lieu à l'Ermont;DU CHEF LIEU A L ERMONT;ERMONT;78326839
CHEMIN;Chemin du Fenillon;DU FENILLON;FENILLON;266709800
CHEMIN RURAL;Chemin rural de Bellevaux à Gembaz;DE BELLEVAUX A GEMBAZ;GEMBAZ;338988536
CHEMIN RURAL;Chemin rural de Chez Maurice au Borgel;DE CHEZ MAURICE AU BORGEL;BORGEL;338500422,338500426,338500428
CHEMIN RURAL;Chemin rural de la Cour;DE LA COUR;COUR;198658708
CHEMIN RURAL;Chemin rural de la Grosse Voie;DE LA GROSSE VOIE;VOIE;340094911
CHEMIN RURAL;Chemin rural des Choseaux;DES CHOSEAUX;CHOSEAUX;340149766
CHEMIN RURAL;Chemin rural du Bosson;DU BOSSON;BOSSON;198658709
CHEMIN RURAL;Chemin rural du Creux;DU CREUX;CREUX;344726713
CHEMIN RURAL;Chemin rural du Fingle;DU FINGLE;FINGLE;340066620
CHEMIN RURAL;Chemin rural du Gros Feu;DU GROS FEU;FEU;340066622,340073563
;Grande Pose;GRANDE POSE;POSE;339074018
;Le Pounant;LE POUNANT;POUNANT;266719459
;Les Tetraz;LES TETRAZ;TETRAZ;315497146
;Passerelle;PASSERELLE;PASSERELLE;338674630
ROUTE;Route de Talonay;DE TALONAY;TALONAY;345949233,345950955
ROUTE;Route de la Chèvrerie;DE LA CHEVRERIE;CHEVRERIE;177014189
ROUTE;Route des Chalets de la Buchille;DES CHALETS DE LA BUCHILLE;BUCHILLE;124904698
ROUTE;Route des Montagnes;DES MONTAGNES;MONTAGNES;30699731,571472936,571472937
ROUTE;Route du Col de Jambaz;DU COL DE JAMBAZ;JAMBAZ;376278739
ROUTE;Route du Col de Terramont;DU COL DE TERRAMONT;TERRAMONT;316607845,571472946,571472947
ROUTE;Route du Fenillon;DU FENILLON;FENILLON;225902301,266709799
ROUTE;Route du Village de Terramont;DU VILLAGE DE TERRAMONT;TERRAMONT;344723414
VOIE COMMUNALE;Voie Communale de Sur les Monts;DE SUR LES MONTS;MONTS;340066621
