voie;name;name_norm;last_word_norm;ways
GRANDE RUE;Grande Rue;;MINARD;165714419
;Les Champs Fontaine Minard;LES CHAMPS FONTAINE MINARD;MINARD;165714417,361680653
LOTISSEMENT;Lotissement Les Fourneaux;LES FOURNEAUX;FOURNEAUX;165714429
RUE;Rue de la Forge Neuve;DE LA FORGE NEUVE;NEUVE;165714427
RUE;Rue de la Liberté;DE LA LIBERTE;LIBERTE;285141910
RUE;Rue de la Rivière;DE LA RIVIERE;RIVIERE;165714434
RUE;Rue des Fours à Chaux;DES FOURS A CHAUX;CHAUX;285141912
RUE;Rue du Château;DU CHATEAU;CHATEAU;165714413,285141916
