voie;name;name_norm;last_word_norm;ways
CHEMIN;Chemin de Jarnezay au Coudreau;DE JARNEZAY AU COUDREAU;COUDREAU;145450834
CHEMIN;Chemin de Jazeneuil aux Rufinières;DE JAZENEUIL AUX RUFINIERES;RUFINIERES;145218145
CHEMIN;Chemin de Jazeneuil à Bois-Métais;DE JAZENEUIL A BOIS METAIS;METAIS;145218135
CHEMIN;Chemin de Jazeneuil à La Barre;DE JAZENEUIL A LA BARRE;BARRE;307430894
CHEMIN;Chemin de Jazeneuil à Lavausseau;DE JAZENEUIL A LAVAUSSEAU;LAVAUSSEAU;145450841,145450847
CHEMIN;Chemin de Jazeneuil à Mongoulin;DE JAZENEUIL A MONGOULIN;MONGOULIN;307429444
CHEMIN;Chemin de Jazeneuil à la Croix-Loret;DE JAZENEUIL A LA CROIX LORET;LORET;145450850
CHEMIN;Chemin de Jazeneuil à la Gaucherie;DE JAZENEUIL A LA GAUCHERIE;GAUCHERIE;145450856
CHEMIN;Chemin de Jazeneuil à la Mirbelière;DE JAZENEUIL A LA MIRBELIERE;MIRBELIERE;145450862
CHEMIN;Chemin de Jazeneuil à la Pétinière;DE JAZENEUIL A LA PETINIERE;PETINIERE;145450866
CHEMIN;Chemin de Jazeneuil à la Vaudebreuil;DE JAZENEUIL A LA VAUDEBREUIL;VAUDEBREUIL;145450869
CHEMIN;Chemin de Mongoulin aux Rufinières;DE MONGOULIN AUX RUFINIERES;RUFINIERES;145450874,145450878,145450885
CHEMIN;Chemin de Mongoulin à la Mimaudière;DE MONGOULIN A LA MIMAUDIERE;MIMAUDIERE;145450888
CHEMIN;Chemin de Sanxay à la Mimaudière;DE SANXAY A LA MIMAUDIERE;MIMAUDIERE;145218137
CHEMIN;Chemin de la Basse Vallée à Jazeneuil;DE LA BASSE VALLEE A JAZENEUIL;JAZENEUIL;145450893
CHEMIN;Chemin de la Basse Vallées à la Vaudebreuil;DE LA BASSE VALLEES A LA VAUDEBREUIL;VAUDEBREUIL;145450900
CHEMIN;Chemin de la Bernardière à la Vaugoyrie;DE LA BERNARDIERE A LA VAUGOYRIE;VAUGOYRIE;145218139
CHEMIN;Chemin de la Carte aux Rufinières;DE LA CARTE AUX RUFINIERES;RUFINIERES;145218172,145218180,145450903
CHEMIN;Chemin de la Chaumelière aux Châtres;DE LA CHAUMELIERE AUX CHATRES;CHATRES;145450911
CHEMIN;Chemin de la Davière à Villegat;DE LA DAVIERE A VILLEGAT;VILLEGAT;145486925
CHEMIN;Chemin de la Fumerie à la Gaud;DE LA FUMERIE A LA GAUD;GAUD;145450921,145450922,145450929
CHEMIN;Chemin de la Gaillarderie à Bois-Métais;DE LA GAILLARDERIE A BOIS METAIS;METAIS;145450939
CHEMIN;Chemin de la Garenne;DE LA GARENNE;GARENNE;145450945
CHEMIN;Chemin de la Gaucherie à Coulombiers;DE LA GAUCHERIE A COULOMBIERS;COULOMBIERS;145450947
CHEMIN;Chemin de la Girauderie à la Carte;DE LA GIRAUDERIE A LA CARTE;CARTE;145450954,145450959
CHEMIN;Chemin de la Grande Rémondière;DE LA GRANDE REMONDIERE;REMONDIERE;145450961,145450966
CHEMIN;Chemin de la Grotte aux Fées;DE LA GROTTE AUX FEES;FEES;146416107
CHEMIN;Chemin de la Mimaudière à Sanxay;DE LA MIMAUDIERE A SANXAY;SANXAY;145218138,145450969,145450976
CHEMIN;Chemin de la Mirbelière à Coulombiers;DE LA MIRBELIERE A COULOMBIERS;COULOMBIERS;145450978
CHEMIN;Chemin de la Nadauderie à la Bernardière;DE LA NADAUDERIE A LA BERNARDIERE;BERNARDIERE;145218140
CHEMIN;Chemin de la Pouanière à la Bernarderie;DE LA POUANIERE A LA BERNARDERIE;BERNARDERIE;145218141
CHEMIN;Chemin de la Pétinière à Lusignan;DE LA PETINIERE A LUSIGNAN;LUSIGNAN;145450983
CHEMIN;Chemin de la Vaugoyrie à Jazeneuil;DE LA VAUGOYRIE A JAZENEUIL;JAZENEUIL;145218142
CHEMIN;Chemin des Châtres aux Touches;DES CHATRES AUX TOUCHES;TOUCHES;145451120
CHEMIN;Chemin des Châtres à Jazeneuil;DES CHATRES A JAZENEUIL;JAZENEUIL;145450990,145450997,145451004
CHEMIN;Chemin des Châtres à la Pétinière;DES CHATRES A LA PETINIERE;PETINIERE;145451006
CHEMIN;Chemin des Quintardières aux Châtres;DES QUINTARDIERES AUX CHATRES;CHATRES;145451012
CHEMIN;Chemin des Quintardières à Jazeneuil;DES QUINTARDIERES A JAZENEUIL;JAZENEUIL;145451018
CHEMIN;Chemin des Tilleuls;DES TILLEULS;TILLEULS;171028568
CHEMIN;Chemin du Bois de Jarnezay;DU BOIS DE JARNEZAY;JARNEZAY;145451023
CHEMIN;Chemin du Châtaigner au Quitardières;DU CHATAIGNER AU QUITARDIERES;QUITARDIERES;145451028,145451033
CHEMIN;Chemin du Coudreau à la Croix-Loret;DU COUDREAU A LA CROIX LORET;LORET;145451036
CHEMIN;Chemin du Coudreau à la Gaud;DU COUDREAU A LA GAUD;GAUD;145451042,145451054,159846055,159846056
CITE;Cité de la Vigne;DE LA VIGNE;VIGNE;145218143,145218144
CITE;Cité des Hautes Vignes;DES HAUTES VIGNES;VIGNES;145218146,145451058
CITE;Cité du Champ de la Croix;DU CHAMP DE LA CROIX;CROIX;435393257
CITE;Cité du Moulin;DU MOULIN;MOULIN;145218147
IMPASSE;Impasse de l'Atelier;DE L ATELIER;ATELIER;636591203
IMPASSE;Impasse des Ecoliers;DES ECOLIERS;ECOLIERS;145218151,145218152
;L'Aquitaine;L AQUITAINE;AQUITAINE;41996335,41996336,41996337,41996338,145486940,145486941,160833812,319341283
;Le Pinacle;LE PINACLE;PINACLE;145218182
PLACE;Place de la Morinerie;DE LA MORINERIE;MORINERIE;636591192
PLACE;Place du Prieuré;DU PRIEURE;PRIEURE;615761364
ROUTE;Route de Curzay à Coulombiers;DE CURZAY A COULOMBIERS;COULOMBIERS;145451070
ROUTE;Route de Curzay à Jazeneuil;DE CURZAY A JAZENEUIL;JAZENEUIL;145486953
ROUTE;Route de Jazeneuil;DE JAZENEUIL;JAZENEUIL;165945328
ROUTE;Route de Jazeneuil à Pamproux;DE JAZENEUIL A PAMPROUX;PAMPROUX;145218155
ROUTE;Route de Lusignan à Saint-Germier;DE LUSIGNAN A SAINT GERMIER;GERMIER;145451079
ROUTE;Route de Mongadon à Lusignan;DE MONGADON A LUSIGNAN;LUSIGNAN;172257838
ROUTE;Route de Villiers à Lusignan;DE VILLIERS A LUSIGNAN;LUSIGNAN;146762749
ROUTE;Route de la Bruyère à Jazeneuil;DE LA BRUYERE A JAZENEUIL;JAZENEUIL;145451102,145451108
RUE;Rue Mélusine;MELUSINE;MELUSINE;118993625
RUE;Rue Pictave;PICTAVE;PICTAVE;145218157,145218158,145218159
RUE;Rue Poirier Chilet;POIRIER CHILET;CHILET;145218160
RUE;Rue Saint-Jacques;SAINT JACQUES;JACQUES;145218162
RUE;Rue Saint-Jean Baptiste;SAINT JEAN BAPTISTE;BAPTISTE;145218156
RUE;Rue Saint-Nicolas;SAINT NICOLAS;NICOLAS;145218161
RUE;Rue de Casse Bots;DE CASSE BOTS;BOTS;145218163
RUE;Rue de Crouzille;DE CROUZILLE;CROUZILLE;145218164
RUE;Rue de l'Atlantique;DE L ATLANTIQUE;ATLANTIQUE;118993601
RUE;Rue de la Gâtine;DE LA GATINE;GATINE;145218165
RUE;Rue de la Quinterie;DE LA QUINTERIE;QUINTERIE;145218166
RUE;Rue des Rocs;DES ROCS;ROCS;145218167
RUE;Rue des Trois Vallées;DES TROIS VALLEES;VALLEES;118993647
RUE;Rue du Pré Sableau;DU PRE SABLEAU;SABLEAU;145218168
RUE;Rue du Vieux Château;DU VIEUX CHATEAU;CHATEAU;118993592
VENELLE;Venelle de l'Aqueduc;DE L AQUEDUC;AQUEDUC;636591210
VOIE COMMUNALE;Voie Communale du Chataignier à Jazeneuil;DU CHATAIGNIER A JAZENEUIL;JAZENEUIL;145218169
VOIE COMMUNALE;Voie Communale du Chataignier à Rouillé;DU CHATAIGNIER A ROUILLE;ROUILLE;145451115
