voie;name;name_norm;last_word_norm;ways
CHEMIN;Chemin de la Grange Neuve;DE LA GRANGE NEUVE;NEUVE;516111045
CHEMIN;Chemin de la Monettrie;DE LA MONETTRIE;MONETTRIE;177170218
CHEMIN;Chemin de la Sicauderie;DE LA SICAUDERIE;SICAUDERIE;177170343
PLACE;Place Gilbert Bécaud;GILBERT BECAUD;BECAUD;161870515
ROUTE;Route Saint-Pierre;SAINT PIERRE;PIERRE;161870500
ROUTE;Route de la Bussière;DE LA BUSSIERE;BUSSIERE;161870488
ROUTE;Route de la Puye;DE LA PUYE;PUYE;447817404
ROUTE;Route de la Vallée des Bois;DE LA VALLEE DES BOIS;BOIS;447817405
ROUTE;Route du Râteau;DU RATEAU;RATEAU;516148810
