voie;name;name_norm;last_word_norm;ways
CHEMIN;Chemin des Puits;DES PUITS;PUITS;238315334
GRANDE RUE;Grande Rue;;COUCHANT;319059930
IMPASSE;Impasse de la Mairie;DE LA MAIRIE;MAIRIE;319059931
IMPASSE;Impasse de la Medela;DE LA MEDELA;MEDELA;238315339
PLACE;Place de la Mairie;DE LA MAIRIE;MAIRIE;319059932
ROUTE;Route de Colombey;DE COLOMBEY;COLOMBEY;319059933
RUE;Rue de la Creuse;DE LA CREUSE;CREUSE;238315344
RUE;Rue du Soleil Couchant;DU SOLEIL COUCHANT;COUCHANT;238315348
RUE;Rue du Val Chevreuil;DU VAL CHEVREUIL;CHEVREUIL;319059934
