voie;name;name_norm;last_word_norm;ways
ALLEE;Allée des Chênes;DES CHENES;CHENES;220714854
CHEMIN;Chemin de Culey-le-Patry à la Bagottière;DE CULEY LE PATRY A LA BAGOTTIERE;BAGOTTIERE;457400085
CHEMIN;Chemin de Culey-le-Patry à la Vigne;DE CULEY LE PATRY A LA VIGNE;VIGNE;457402006
CHEMIN;Chemin de la Boulaye;DE LA BOULAYE;BOULAYE;220641029
CHEMIN;Chemin de la Planche Bagot;DE LA PLANCHE BAGOT;BAGOT;457400086
CHEMIN;Chemin de la Vigne au Pontde la Mousse;DE LA VIGNE AU PONTDE LA MOUSSE;MOUSSE;359360563
CHEMIN;Chemin de la Vigne au Prieuré;DE LA VIGNE AU PRIEURE;PRIEURE;457400087,606327596
CHEMIN;Chemin du Pont de la Mousse à Saint-Martin-de-Sallen;DU PONT DE LA MOUSSE A SAINT MARTIN DE SALLEN;SALLEN;457400088,606325570,606325574
VOIE COMMUNALE;Voie Communale de la Vigne aux ...;DE LA VIGNE AUX;AUX;81531705
