voie;name;name_norm;last_word_norm;ways
RUE;Rue d'Arsure;D ARSURE;ARSURE;317479875
RUE;Rue d'Arsurette;D ARSURETTE;ARSURETTE;317479874
RUE;Rue de la Bataille;DE LA BATAILLE;BATAILLE;259195408
RUE;Rue de la Tannerie;DE LA TANNERIE;TANNERIE;317479876
RUE;Rue de la Vie Blanche;DE LA VIE BLANCHE;BLANCHE;251075495
RUE;Rue de la Vie à Mont;DE LA VIE A MONT;MONT;251075486,251075490
RUE;Rue du Bayard;DU BAYARD;BAYARD;149278751
RUE;Rue du Clôs Calais;DU CLOS CALAIS;CALAIS;317479877
RUE;Rue du Clôs Vaillant;DU CLOS VAILLANT;VAILLANT;251075479
