voie;name;name_norm;last_word_norm;ways
VOIE COMMUNALE;Voie Communale d'Enclaverie;D ENCLAVERIE;ENCLAVERIE;102322442,102322445
VOIE COMMUNALE;Voie Communale d'en Jouaniquet;D EN JOUANIQUET;JOUANIQUET;102322436
VOIE COMMUNALE;Voie Communale de Entraouère;DE ENTRAOUERE;ENTRAOUERE;112178778
VOIE COMMUNALE;Voie Communale de Mirande à Sansan;DE MIRANDE A SANSAN;SANSAN;467812398
VOIE COMMUNALE;Voie Communale de Percuray;DE PERCURAY;PERCURAY;112178764
VOIE COMMUNALE;Voie Communale de Vicnau;DE VICNAU;VICNAU;102322431,102322437,284412284
VOIE COMMUNALE;Voie Communale de l'Intendant;DE L INTENDANT;INTENDANT;113210749
VOIE COMMUNALE;Voie Communale du Mounar;DU MOUNAR;MOUNAR;112178773
