voie;name;name_norm;last_word_norm;ways
LIGNE;Ligne de Châteauneuf-sur-Charente à Saint-Mariens - Saint-Yzan;DE CHATEAUNEUF SUR CHARENTE A SAINT MARIENS   SAINT YZAN;YZAN;111959762
RUE;Rue de la Commanderie;DE LA COMMANDERIE;COMMANDERIE;111959780
RUE;Rue de la Mangarderie;DE LA MANGARDERIE;MANGARDERIE;369918218
RUE;Rue des Templiers;DES TEMPLIERS;TEMPLIERS;111959744
RUE;Rue des Tilleuls;DES TILLEULS;TILLEULS;244004417
RUE;Rue du Moulin à Deveau;DU MOULIN A DEVEAU;DEVEAU;150668270
RUE;Rue du Pont Gouillard;DU PONT GOUILLARD;GOUILLARD;128887095,150668272,150668284
