voie;name;name_norm;last_word_norm;ways
CHEMIN;Chemin de Belcastel à Cros;DE BELCASTEL A CROS;CROS;343657197
CHEMIN;Chemin de Buc à Belcastel;DE BUC A BELCASTEL;BELCASTEL;343657198
CHEMIN;Chemin de Cananilles;DE CANANILLES;CANANILLES;163709049
CHEMIN;Chemin de Cros à Belcastel;DE CROS A BELCASTEL;BELCASTEL;328314680
CHEMIN;Chemin de Gauzy;DE GAUZY;GAUZY;163709041
CHEMIN;Chemin de Limoux à Mouthoumet et Albières;DE LIMOUX A MOUTHOUMET ET ALBIERES;ALBIERES;88818278
CHEMIN;Chemin de Saint-Polycarpe à Villardebelle;DE SAINT POLYCARPE A VILLARDEBELLE;VILLARDEBELLE;163709063
ROUTE;Route de Buc;DE BUC;BUC;88858870
