voie;name;name_norm;last_word_norm;ways
ROUTE;Route Forestière de Mainvillers;FORESTIERE DE MAINVILLERS;MAINVILLERS;98647398
ROUTE;Route Forestière de la Poudrière;FORESTIERE DE LA POUDRIERE;POUDRIERE;98647416
ROUTE;Route Forestière de la Vierge;FORESTIERE DE LA VIERGE;VIERGE;98647448
ROUTE;Route Forestière du Haut de Saint-Pierre;FORESTIERE DU HAUT DE SAINT PIERRE;PIERRE;307260185
ROUTE;Route Forestière du Hêtre au Loup;FORESTIERE DU HETRE AU LOUP;LOUP;98647396
ROUTE;Route Forestière du Trou de l'Ermite;FORESTIERE DU TROU DE L ERMITE;ERMITE;98647449
RUE;Rue Principale;PRINCIPALE;PRINCIPALE;417907815
RUE;Rue de l'École;DE L ECOLE;ECOLE;417907822
