voie;name;name_norm;last_word_norm;ways
CHEMIN;Chemin d'Orcourt aux Grands Pâtis;D ORCOURT AUX GRANDS PATIS;PATIS;570969737
CHEMIN;Chemin de l'Ancienne Route de Fleury;DE L ANCIENNE ROUTE DE FLEURY;FLEURY;504073816
CHEMIN;Chemin de la Bertellerie;DE LA BERTELLERIE;BERTELLERIE;210562217
CHEMIN;Chemin de la Butte;DE LA BUTTE;BUTTE;321893615
;Grande Rue;GRANDE RUE;RUE;647260155
PLACE;Place Saint-Pierre;SAINT PIERRE;PIERRE;210562216
RUE;Rue du Paradis;DU PARADIS;PARADIS;210561075
VOIE;Voie d'Orcourt à Grandpré;D ORCOURT A GRANDPRE;GRANDPRE;39405841
