voie;name;name_norm;last_word_norm;ways
;Accès à la Voie La Directe des Boeufs;ACCES A LA VOIE LA DIRECTE DES BOEUFS;BOEUFS;27683113
CHEMIN RURAL;Chemin Rural de la Combe Noirs;DE LA COMBE NOIRS;NOIRS;420909701
CHEMIN;Chemin de la Combe Noire;DE LA COMBE NOIRE;NOIRE;70547700,70553451
CHEMIN;Chemin de la Morce;DE LA MORCE;MORCE;70553450
CHEMIN;Chemins de la mine;S DE LA MINE;MINE;124080401
ROUTE;Route d'Entrevernes;D ENTREVERNES;ENTREVERNES;420217231
ROUTE;Route de la Montagne;DE LA MONTAGNE;MONTAGNE;70547713
ROUTE;Route des Droblesses;DES DROBLESSES;DROBLESSES;490725949
ROUTE;Route du Cimetière;DU CIMETIERE;CIMETIERE;70553644
