voie;name;name_norm;last_word_norm;ways
CHEMIN;Chemin d'En Boulou;D EN BOULOU;BOULOU;84671443
ROUTE;Route de Briatexte à Bourg-Saint-Bernard;DE BRIATEXTE A BOURG SAINT BERNARD;BERNARD;41126891
ROUTE;Route de Saint-Léon à Teulat;DE SAINT LEON A TEULAT;TEULAT;41124156
ROUTE;Route de Teulat à Lavaur;DE TEULAT A LAVAUR;LAVAUR;41126893
ROUTE;Route de Teulat à Vaour;DE TEULAT A VAOUR;VAOUR;106971279
ROUTE;Route de Verfeil à Montaussel;DE VERFEIL A MONTAUSSEL;MONTAUSSEL;35304425
ROUTE;Route de la Garde;DE LA GARDE;GARDE;41128881
RUE;Rue de l'Église;DE L EGLISE;EGLISE;41126902
