voie;name;name_norm;last_word_norm;ways
CHEMIN RURAL;Chemin rural de la Borne Morin;DE LA BORNE MORIN;MORIN;396671190
CHEMIN RURAL;Chemin rural dit Derrière du Lien;DIT DERRIERE DU LIEN;LIEN;371679328
CHEMIN RURAL;Chemin rural dit de Hinot;DIT DE HINOT;HINOT;371679330,396673089
CHEMIN RURAL;Chemin rural dit de la Voie des Limes;DIT DE LA VOIE DES LIMES;LIMES;371679698
;Grande Rue;GRANDE RUE;RUE;371679322
RUE;Rue de France;DE FRANCE;FRANCE;371679323
RUE;Rue de la Rivière;DE LA RIVIERE;RIVIERE;371679324
RUE;Rue du Moulin;DU MOULIN;MOULIN;234136164,455813513,455813514
