voie;name;name_norm;last_word_norm;ways
;Haut de Celle;HAUT DE CELLE;CELLE;263943446,282284631,315489137
RUE;Rue de la Cordière;DE LA CORDIERE;CORDIERE;141053278
RUE;Rue des Hattards;DES HATTARDS;HATTARDS;128852157,141048001
RUE;Rue du Beau Chêne;DU BEAU CHENE;CHENE;128852148,128853503,129307401
RUE;Rue du Haut Mont;DU HAUT MONT;MONT;128853496
RUE;Rue du Haut de Gemel;DU HAUT DE GEMEL;GEMEL;128852133,128852160
RUE;Rue du Village;DU VILLAGE;VILLAGE;128852147,128853486,128853490,229635203,229635205,301944780,301944781
;Sur le Four du Haut du Mont;SUR LE FOUR DU HAUT DU MONT;MONT;128853523
