voie;name;name_norm;last_word_norm;ways
CHEMIN;Chemin de Le par le Fayet;DE LE PAR LE FAYET;FAYET;123020342,650021749
;La Garenne de Lefaux S;LA GARENNE DE LEFAUX S;S;164926905
RUE;Rue Neuve;NEUVE;NEUVE;226138290
RUE;Rue de Le Motte;DE LE MOTTE;MOTTE;96024260
RUE;Rue de la Tour;DE LA TOUR;TOUR;96024244,157553734,650021750
RUE;Rue des Marettes;DES MARETTES;MARETTES;96024247,96024258,321857899
RUE;Rue du Mont du Fayel;DU MONT DU FAYEL;FAYEL;153943530,226138293,321857900
RUE;Rue du Point du Jour;DU POINT DU JOUR;JOUR;96024263,444547653
