voie;name;name_norm;last_word_norm;ways
ALLEE;Allée François Langlois;FRANCOIS LANGLOIS;LANGLOIS;179688024
CHEMIN;Chemin de Sainte-Barbe;DE SAINTE BARBE;BARBE;180858313
IMPASSE;Impasse de la Ferme;DE LA FERME;FERME;179688019
IMPASSE;Impasse de la Haye-le-Comte;DE LA HAYE LE COMTE;COMTE;180019842
ROUTE;Route de la Haye Le Comte;DE LA HAYE LE COMTE;COMTE;125011310
ROUTE;Route des Quatre Chemins;DES QUATRE CHEMINS;CHEMINS;180019839
ROUTE;Route du Neubourg;DU NEUBOURG;NEUBOURG;653261707
ROUTE;Route du Petit Mesnil;DU PETIT MESNIL;MESNIL;179686653
