voie;name;name_norm;last_word_norm;ways
CHEMIN RURAL;Chemin Rural d'Ayrens;D AYRENS;AYRENS;64055470,64055479,64055492
CHEMIN RURAL;Chemin Rural de Capdasé à Encatalan;DE CAPDASE A ENCATALAN;ENCATALAN;64055482,64055515,64055532
CHEMIN RURAL;Chemin Rural de la Devise;DE LA DEVISE;DEVISE;63565947
CHEMIN;Chemin de Lauret à Mauvezin;DE LAURET A MAUVEZIN;MAUVEZIN;64055458,64055522,64055531,64055557
CHEMIN;Chemin de Mansempuy à la Croix;DE MANSEMPUY A LA CROIX;CROIX;64055505
CHEMIN;Chemin de Mensempuy à Monfort;DE MENSEMPUY A MONFORT;MONFORT;63565981
CHEMIN;Chemin de Puicasquier à Mauvezin;DE PUICASQUIER A MAUVEZIN;MAUVEZIN;64055463,64055474,64055528,64055536,64055555
CHEMIN;Chemin de Sérempuy à Saint-Antonin;DE SEREMPUY A SAINT ANTONIN;ANTONIN;64055507,64055521,64055556
